Title,Description,BiocVersion,Genome,SourceType,SourceUrl,SourceVersion,Species,TaxonomyId,Coordinate_1_based,DataProvider,Maintainer,RDataClass,DispatchClass,ResourceName
Genome annotations for Endotrypanum monterogeii strain LV88,TriTrypDB 28 annotations for Endotrypanum monterogeii strain LV88,3.4,LmjF28,GFF,http://TriTrypDB.org/common/downloads/Current_Release/EmonterogeiiLV88/gff/data/TriTrypDB-28_EmonterogeiiLV88.gff,28,Endotrypanum monterogeii strain LV88,NA,TRUE,TriTrypDB,Keith Hughitt <khughitt@umd.edu>,TxDb,Rda,LmjF_TxDb.rda
Genome annotations for Entamoeba moshkovskii Laredo,AmoebaDB 28 annotations for Entamoeba moshkovskii Laredo,3.4,LmjF28,GFF,http://AmoebaDB.org/common/downloads/Current_Release/EmoshkovskiiLaredo/gff/data/AmoebaDB-28_EmoshkovskiiLaredo.gff,28,Entamoeba moshkovskii Laredo,NA,TRUE,AmoebaDB,Keith Hughitt <khughitt@umd.edu>,TxDb,Rda,LmjF_TxDb.rda
Genome annotations for Eimeria necatrix Houghton,ToxoDB 28 annotations for Eimeria necatrix Houghton,3.4,LmjF28,GFF,http://ToxoDB.org/common/downloads/Current_Release/EnecatrixHoughton/gff/data/ToxoDB-28_EnecatrixHoughton.gff,28,Eimeria necatrix Houghton,NA,TRUE,ToxoDB,Keith Hughitt <khughitt@umd.edu>,TxDb,Rda,LmjF_TxDb.rda
Genome annotations for Entamoeba nuttalli P19,AmoebaDB 28 annotations for Entamoeba nuttalli P19,3.4,LmjF28,GFF,http://AmoebaDB.org/common/downloads/Current_Release/EnuttalliP19/gff/data/AmoebaDB-28_EnuttalliP19.gff,28,Entamoeba nuttalli P19,1076696,TRUE,AmoebaDB,Keith Hughitt <khughitt@umd.edu>,TxDb,Rda,LmjF_TxDb.rda
Genome annotations for Eimeria praecox Houghton,ToxoDB 28 annotations for Eimeria praecox Houghton,3.4,LmjF28,GFF,http://ToxoDB.org/common/downloads/Current_Release/EpraecoxHoughton/gff/data/ToxoDB-28_EpraecoxHoughton.gff,28,Eimeria praecox Houghton,NA,TRUE,ToxoDB,Keith Hughitt <khughitt@umd.edu>,TxDb,Rda,LmjF_TxDb.rda
Genome annotations for Encephalitozoon romaleae SJ-2008,MicrosporidiaDB 28 annotations for Encephalitozoon romaleae SJ-2008,3.4,LmjF28,GFF,http://MicrosporidiaDB.org/common/downloads/Current_Release/EromaleaeSJ2008/gff/data/MicrosporidiaDB-28_EromaleaeSJ2008.gff,28,Encephalitozoon romaleae SJ-2008,1178016,TRUE,MicrosporidiaDB,Keith Hughitt <khughitt@umd.edu>,TxDb,Rda,LmjF_TxDb.rda
Genome annotations for Eimeria tenella strain Houghton,ToxoDB 28 annotations for Eimeria tenella strain Houghton,3.4,LmjF28,GFF,http://ToxoDB.org/common/downloads/Current_Release/EtenellaHoughton/gff/data/ToxoDB-28_EtenellaHoughton.gff,28,Eimeria tenella strain Houghton,413949,TRUE,ToxoDB,Keith Hughitt <khughitt@umd.edu>,TxDb,Rda,LmjF_TxDb.rda
Genome annotations for Giardia Assemblage A2 isolate DH,GiardiaDB 28 annotations for Giardia Assemblage A2 isolate DH,3.4,LmjF28,GFF,http://GiardiaDB.org/common/downloads/Current_Release/GintestinalisAssemblageADH/gff/data/GiardiaDB-28_GintestinalisAssemblageADH.gff,28,Giardia Assemblage A2 isolate DH,NA,TRUE,GiardiaDB,Keith Hughitt <khughitt@umd.edu>,TxDb,Rda,LmjF_TxDb.rda
Genome annotations for Giardia Assemblage A isolate WB,GiardiaDB 28 annotations for Giardia Assemblage A isolate WB,3.4,LmjF28,GFF,http://GiardiaDB.org/common/downloads/Current_Release/GintestinalisAssemblageA/gff/data/GiardiaDB-28_GintestinalisAssemblageA.gff,28,Giardia Assemblage A isolate WB,184922,TRUE,GiardiaDB,Keith Hughitt <khughitt@umd.edu>,TxDb,Rda,LmjF_TxDb.rda
Genome annotations for Giardia Assemblage B isolate GS,GiardiaDB 28 annotations for Giardia Assemblage B isolate GS,3.4,LmjF28,GFF,http://GiardiaDB.org/common/downloads/Current_Release/GintestinalisAssemblageB/gff/data/GiardiaDB-28_GintestinalisAssemblageB.gff,28,Giardia Assemblage B isolate GS,598745,TRUE,GiardiaDB,Keith Hughitt <khughitt@umd.edu>,TxDb,Rda,LmjF_TxDb.rda
Genome annotations for Giardia Assemblage B isolate GS_B,GiardiaDB 28 annotations for Giardia Assemblage B isolate GS_B,3.4,LmjF28,GFF,http://GiardiaDB.org/common/downloads/Current_Release/GintestinalisAssemblageBGS_B/gff/data/GiardiaDB-28_GintestinalisAssemblageBGS_B.gff,28,Giardia Assemblage B isolate GS_B,NA,TRUE,GiardiaDB,Keith Hughitt <khughitt@umd.edu>,TxDb,Rda,LmjF_TxDb.rda
Genome annotations for Giardia Assemblage E isolate P15,GiardiaDB 28 annotations for Giardia Assemblage E isolate P15,3.4,LmjF28,GFF,http://GiardiaDB.org/common/downloads/Current_Release/GintestinalisAssemblageE/gff/data/GiardiaDB-28_GintestinalisAssemblageE.gff,28,Giardia Assemblage E isolate P15,658858,TRUE,GiardiaDB,Keith Hughitt <khughitt@umd.edu>,TxDb,Rda,LmjF_TxDb.rda
Genome annotations for Gregarina niphandrodes Unknown strain,CryptoDB 28 annotations for Gregarina niphandrodes Unknown strain,3.4,LmjF28,GFF,http://CryptoDB.org/common/downloads/Current_Release/GniphandrodesUnknown/gff/data/CryptoDB-28_GniphandrodesUnknown.gff,28,Gregarina niphandrodes Unknown strain,NA,TRUE,CryptoDB,Keith Hughitt <khughitt@umd.edu>,TxDb,Rda,LmjF_TxDb.rda
Genome annotations for Hammondia hammondi strain H.H.34,ToxoDB 28 annotations for Hammondia hammondi strain H.H.34,3.4,LmjF28,GFF,http://ToxoDB.org/common/downloads/Current_Release/HhammondiHH34/gff/data/ToxoDB-28_HhammondiHH34.gff,28,Hammondia hammondi strain H.H.34,NA,TRUE,ToxoDB,Keith Hughitt <khughitt@umd.edu>,TxDb,Rda,LmjF_TxDb.rda
Genome annotations for Hamiltosporidium tvaerminnensis OER-3-3,MicrosporidiaDB 28 annotations for Hamiltosporidium tvaerminnensis OER-3-3,3.4,LmjF28,GFF,http://MicrosporidiaDB.org/common/downloads/Current_Release/HtvaerminnensisOER-3-3/gff/data/MicrosporidiaDB-28_HtvaerminnensisOER-3-3.gff,28,Hamiltosporidium tvaerminnensis OER-3-3,657448,TRUE,MicrosporidiaDB,Keith Hughitt <khughitt@umd.edu>,TxDb,Rda,LmjF_TxDb.rda
Genome annotations for Leishmania aethiopica L147,TriTrypDB 28 annotations for Leishmania aethiopica L147,3.4,LmjF28,GFF,http://TriTrypDB.org/common/downloads/Current_Release/LaethiopicaL147/gff/data/TriTrypDB-28_LaethiopicaL147.gff,28,Leishmania aethiopica L147,1206056,TRUE,TriTrypDB,Keith Hughitt <khughitt@umd.edu>,TxDb,Rda,LmjF_TxDb.rda
Genome annotations for Leishmania amazonensis MHOM/BR/71973/M2269,TriTrypDB 28 annotations for Leishmania amazonensis MHOM/BR/71973/M2269,3.4,LmjF28,GFF,http://TriTrypDB.org/common/downloads/Current_Release/LamazonensisMHOMBR71973M2269/gff/data/TriTrypDB-28_LamazonensisMHOMBR71973M2269.gff,28,Leishmania amazonensis MHOM/BR/71973/M2269,NA,TRUE,TriTrypDB,Keith Hughitt <khughitt@umd.edu>,TxDb,Rda,LmjF_TxDb.rda
Genome annotations for Leishmania arabica strain LEM1108,TriTrypDB 28 annotations for Leishmania arabica strain LEM1108,3.4,LmjF28,GFF,http://TriTrypDB.org/common/downloads/Current_Release/LarabicaLEM1108/gff/data/TriTrypDB-28_LarabicaLEM1108.gff,28,Leishmania arabica strain LEM1108,NA,TRUE,TriTrypDB,Keith Hughitt <khughitt@umd.edu>,TxDb,Rda,LmjF_TxDb.rda
Genome annotations for Leishmania braziliensis MHOM/BR/75/M2903,TriTrypDB 28 annotations for Leishmania braziliensis MHOM/BR/75/M2903,3.4,LmjF28,GFF,http://TriTrypDB.org/common/downloads/Current_Release/LbraziliensisMHOMBR75M2903/gff/data/TriTrypDB-28_LbraziliensisMHOMBR75M2903.gff,28,Leishmania braziliensis MHOM/BR/75/M2903,1295825,TRUE,TriTrypDB,Keith Hughitt <khughitt@umd.edu>,TxDb,Rda,LmjF_TxDb.rda
Genome annotations for Leishmania braziliensis MHOM/BR/75/M2904,TriTrypDB 28 annotations for Leishmania braziliensis MHOM/BR/75/M2904,3.4,LmjF28,GFF,http://TriTrypDB.org/common/downloads/Current_Release/LbraziliensisMHOMBR75M2904/gff/data/TriTrypDB-28_LbraziliensisMHOMBR75M2904.gff,28,Leishmania braziliensis MHOM/BR/75/M2904,420245,TRUE,TriTrypDB,Keith Hughitt <khughitt@umd.edu>,TxDb,Rda,LmjF_TxDb.rda
Genome annotations for Leishmania donovani strain BHU 1220,TriTrypDB 28 annotations for Leishmania donovani strain BHU 1220,3.4,LmjF28,GFF,http://TriTrypDB.org/common/downloads/Current_Release/LdonovaniBHU1220/gff/data/TriTrypDB-28_LdonovaniBHU1220.gff,28,Leishmania donovani strain BHU 1220,NA,TRUE,TriTrypDB,Keith Hughitt <khughitt@umd.edu>,TxDb,Rda,LmjF_TxDb.rda
Genome annotations for Leishmania donovani BPK282A1,TriTrypDB 28 annotations for Leishmania donovani BPK282A1,3.4,LmjF28,GFF,http://TriTrypDB.org/common/downloads/Current_Release/LdonovaniBPK282A1/gff/data/TriTrypDB-28_LdonovaniBPK282A1.gff,28,Leishmania donovani BPK282A1,981087,TRUE,TriTrypDB,Keith Hughitt <khughitt@umd.edu>,TxDb,Rda,LmjF_TxDb.rda
Genome annotations for Leishmania enriettii strain LEM3045,TriTrypDB 28 annotations for Leishmania enriettii strain LEM3045,3.4,LmjF28,GFF,http://TriTrypDB.org/common/downloads/Current_Release/LenriettiiLEM3045/gff/data/TriTrypDB-28_LenriettiiLEM3045.gff,28,Leishmania enriettii strain LEM3045,NA,TRUE,TriTrypDB,Keith Hughitt <khughitt@umd.edu>,TxDb,Rda,LmjF_TxDb.rda
Genome annotations for Leishmania gerbilli strain LEM452,TriTrypDB 28 annotations for Leishmania gerbilli strain LEM452,3.4,LmjF28,GFF,http://TriTrypDB.org/common/downloads/Current_Release/LgerbilliLEM452/gff/data/TriTrypDB-28_LgerbilliLEM452.gff,28,Leishmania gerbilli strain LEM452,NA,TRUE,TriTrypDB,Keith Hughitt <khughitt@umd.edu>,TxDb,Rda,LmjF_TxDb.rda
Genome annotations for Leishmania infantum JPCM5,TriTrypDB 28 annotations for Leishmania infantum JPCM5,3.4,LmjF28,GFF,http://TriTrypDB.org/common/downloads/Current_Release/LinfantumJPCM5/gff/data/TriTrypDB-28_LinfantumJPCM5.gff,28,Leishmania infantum JPCM5,435258,TRUE,TriTrypDB,Keith Hughitt <khughitt@umd.edu>,TxDb,Rda,LmjF_TxDb.rda
Genome annotations for Leishmania major strain Friedlin,TriTrypDB 28 annotations for Leishmania major strain Friedlin,3.4,LmjF28,GFF,http://TriTrypDB.org/common/downloads/Current_Release/LmajorFriedlin/gff/data/TriTrypDB-28_LmajorFriedlin.gff,28,Leishmania major strain Friedlin,347515,TRUE,TriTrypDB,Keith Hughitt <khughitt@umd.edu>,TxDb,Rda,LmjF_TxDb.rda
Genome annotations for Leishmania major strain LV39c5,TriTrypDB 28 annotations for Leishmania major strain LV39c5,3.4,LmjF28,GFF,http://TriTrypDB.org/common/downloads/Current_Release/LmajorLV39c5/gff/data/TriTrypDB-28_LmajorLV39c5.gff,28,Leishmania major strain LV39c5,860569,TRUE,TriTrypDB,Keith Hughitt <khughitt@umd.edu>,TxDb,Rda,LmjF_TxDb.rda
Genome annotations for Leishmania major strain SD 75.1,TriTrypDB 28 annotations for Leishmania major strain SD 75.1,3.4,LmjF28,GFF,http://TriTrypDB.org/common/downloads/Current_Release/LmajorSD75.1/gff/data/TriTrypDB-28_LmajorSD75.1.gff,28,Leishmania major strain SD 75.1,860570,TRUE,TriTrypDB,Keith Hughitt <khughitt@umd.edu>,TxDb,Rda,LmjF_TxDb.rda
Genome annotations for Leishmania mexicana MHOM/GT/2001/U1103,TriTrypDB 28 annotations for Leishmania mexicana MHOM/GT/2001/U1103,3.4,LmjF28,GFF,http://TriTrypDB.org/common/downloads/Current_Release/LmexicanaMHOMGT2001U1103/gff/data/TriTrypDB-28_LmexicanaMHOMGT2001U1103.gff,28,Leishmania mexicana MHOM/GT/2001/U1103,929439,TRUE,TriTrypDB,Keith Hughitt <khughitt@umd.edu>,TxDb,Rda,LmjF_TxDb.rda
Genome annotations for Leishmania panamensis MHOM/COL/81/L13,TriTrypDB 28 annotations for Leishmania panamensis MHOM/COL/81/L13,3.4,LmjF28,GFF,http://TriTrypDB.org/common/downloads/Current_Release/LpanamensisMHOMCOL81L13/gff/data/TriTrypDB-28_LpanamensisMHOMCOL81L13.gff,28,Leishmania panamensis MHOM/COL/81/L13,1295824,TRUE,TriTrypDB,Keith Hughitt <khughitt@umd.edu>,TxDb,Rda,LmjF_TxDb.rda
Genome annotations for Leptomonas pyrrhocoris H10,TriTrypDB 28 annotations for Leptomonas pyrrhocoris H10,3.4,LmjF28,GFF,http://TriTrypDB.org/common/downloads/Current_Release/LpyrrhocorisH10/gff/data/TriTrypDB-28_LpyrrhocorisH10.gff,28,Leptomonas pyrrhocoris H10,NA,TRUE,TriTrypDB,Keith Hughitt <khughitt@umd.edu>,TxDb,Rda,LmjF_TxDb.rda
Genome annotations for Leptomonas seymouri ATCC 30220,TriTrypDB 28 annotations for Leptomonas seymouri ATCC 30220,3.4,LmjF28,GFF,http://TriTrypDB.org/common/downloads/Current_Release/LseymouriATCC30220/gff/data/TriTrypDB-28_LseymouriATCC30220.gff,28,Leptomonas seymouri ATCC 30220,NA,TRUE,TriTrypDB,Keith Hughitt <khughitt@umd.edu>,TxDb,Rda,LmjF_TxDb.rda
Genome annotations for Leishmania sp. MAR LEM2494,TriTrypDB 28 annotations for Leishmania sp. MAR LEM2494,3.4,LmjF28,GFF,http://TriTrypDB.org/common/downloads/Current_Release/LspMARLEM2494/gff/data/TriTrypDB-28_LspMARLEM2494.gff,28,Leishmania sp. MAR LEM2494,1303197,TRUE,TriTrypDB,Keith Hughitt <khughitt@umd.edu>,TxDb,Rda,LmjF_TxDb.rda
Genome annotations for Leishmania tarentolae Parrot-TarII,TriTrypDB 28 annotations for Leishmania tarentolae Parrot-TarII,3.4,LmjF28,GFF,http://TriTrypDB.org/common/downloads/Current_Release/LtarentolaeParrotTarII/gff/data/TriTrypDB-28_LtarentolaeParrotTarII.gff,28,Leishmania tarentolae Parrot-TarII,NA,TRUE,TriTrypDB,Keith Hughitt <khughitt@umd.edu>,TxDb,Rda,LmjF_TxDb.rda
Genome annotations for Leishmania tropica L590,TriTrypDB 28 annotations for Leishmania tropica L590,3.4,LmjF28,GFF,http://TriTrypDB.org/common/downloads/Current_Release/LtropicaL590/gff/data/TriTrypDB-28_LtropicaL590.gff,28,Leishmania tropica L590,1206058,TRUE,TriTrypDB,Keith Hughitt <khughitt@umd.edu>,TxDb,Rda,LmjF_TxDb.rda
Genome annotations for Leishmania turanica strain LEM423,TriTrypDB 28 annotations for Leishmania turanica strain LEM423,3.4,LmjF28,GFF,http://TriTrypDB.org/common/downloads/Current_Release/LturanicaLEM423/gff/data/TriTrypDB-28_LturanicaLEM423.gff,28,Leishmania turanica strain LEM423,NA,TRUE,TriTrypDB,Keith Hughitt <khughitt@umd.edu>,TxDb,Rda,LmjF_TxDb.rda
Genome annotations for Mitosporidium daphniae UGP3,MicrosporidiaDB 28 annotations for Mitosporidium daphniae UGP3,3.4,LmjF28,GFF,http://MicrosporidiaDB.org/common/downloads/Current_Release/MdaphniaeUGP3/gff/data/MicrosporidiaDB-28_MdaphniaeUGP3.gff,28,Mitosporidium daphniae UGP3,NA,TRUE,MicrosporidiaDB,Keith Hughitt <khughitt@umd.edu>,TxDb,Rda,LmjF_TxDb.rda
Genome annotations for Nosema bombycis CQ1,MicrosporidiaDB 28 annotations for Nosema bombycis CQ1,3.4,LmjF28,GFF,http://MicrosporidiaDB.org/common/downloads/Current_Release/NbombycisCQ1/gff/data/MicrosporidiaDB-28_NbombycisCQ1.gff,28,Nosema bombycis CQ1,578461,TRUE,MicrosporidiaDB,Keith Hughitt <khughitt@umd.edu>,TxDb,Rda,LmjF_TxDb.rda
Genome annotations for Neospora caninum Liverpool,ToxoDB 28 annotations for Neospora caninum Liverpool,3.4,LmjF28,GFF,http://ToxoDB.org/common/downloads/Current_Release/NcaninumLIV/gff/data/ToxoDB-28_NcaninumLIV.gff,28,Neospora caninum Liverpool,572307,TRUE,ToxoDB,Keith Hughitt <khughitt@umd.edu>,TxDb,Rda,LmjF_TxDb.rda
Genome annotations for Nosema ceranae BRL01,MicrosporidiaDB 28 annotations for Nosema ceranae BRL01,3.4,LmjF28,GFF,http://MicrosporidiaDB.org/common/downloads/Current_Release/NceranaeBRL01/gff/data/MicrosporidiaDB-28_NceranaeBRL01.gff,28,Nosema ceranae BRL01,578460,TRUE,MicrosporidiaDB,Keith Hughitt <khughitt@umd.edu>,TxDb,Rda,LmjF_TxDb.rda
Genome annotations for Nematocida sp. 1 ERTm2,MicrosporidiaDB 28 annotations for Nematocida sp. 1 ERTm2,3.4,LmjF28,GFF,http://MicrosporidiaDB.org/common/downloads/Current_Release/NematocidaSp1ERTm2/gff/data/MicrosporidiaDB-28_NematocidaSp1ERTm2.gff,28,Nematocida sp. 1 ERTm2,944018,TRUE,MicrosporidiaDB,Keith Hughitt <khughitt@umd.edu>,TxDb,Rda,LmjF_TxDb.rda
Genome annotations for Naegleria fowleri ATCC 30863,AmoebaDB 28 annotations for Naegleria fowleri ATCC 30863,3.4,LmjF28,GFF,http://AmoebaDB.org/common/downloads/Current_Release/NfowleriATCC30863/gff/data/AmoebaDB-28_NfowleriATCC30863.gff,28,Naegleria fowleri ATCC 30863,NA,TRUE,AmoebaDB,Keith Hughitt <khughitt@umd.edu>,TxDb,Rda,LmjF_TxDb.rda
Genome annotations for Nematocida parisii ERTm1,MicrosporidiaDB 28 annotations for Nematocida parisii ERTm1,3.4,LmjF28,GFF,http://MicrosporidiaDB.org/common/downloads/Current_Release/NparisiiERTm1/gff/data/MicrosporidiaDB-28_NparisiiERTm1.gff,28,Nematocida parisii ERTm1,881290,TRUE,MicrosporidiaDB,Keith Hughitt <khughitt@umd.edu>,TxDb,Rda,LmjF_TxDb.rda
Genome annotations for Nematocida parisii ERTm3,MicrosporidiaDB 28 annotations for Nematocida parisii ERTm3,3.4,LmjF28,GFF,http://MicrosporidiaDB.org/common/downloads/Current_Release/NparisiiERTm3/gff/data/MicrosporidiaDB-28_NparisiiERTm3.gff,28,Nematocida parisii ERTm3,935791,TRUE,MicrosporidiaDB,Keith Hughitt <khughitt@umd.edu>,TxDb,Rda,LmjF_TxDb.rda
Genome annotations for Nematocida sp. 1 ERTm6,MicrosporidiaDB 28 annotations for Nematocida sp. 1 ERTm6,3.4,LmjF28,GFF,http://MicrosporidiaDB.org/common/downloads/Current_Release/Nsp1ERTm6/gff/data/MicrosporidiaDB-28_Nsp1ERTm6.gff,28,Nematocida sp. 1 ERTm6,1138374,TRUE,MicrosporidiaDB,Keith Hughitt <khughitt@umd.edu>,TxDb,Rda,LmjF_TxDb.rda
Genome annotations for Ordospora colligata OC4,MicrosporidiaDB 28 annotations for Ordospora colligata OC4,3.4,LmjF28,GFF,http://MicrosporidiaDB.org/common/downloads/Current_Release/OcolligataOC4/gff/data/MicrosporidiaDB-28_OcolligataOC4.gff,28,Ordospora colligata OC4,NA,TRUE,MicrosporidiaDB,Keith Hughitt <khughitt@umd.edu>,TxDb,Rda,LmjF_TxDb.rda
Genome annotations for Plasmodium berghei ANKA,PlasmoDB 28 annotations for Plasmodium berghei ANKA,3.4,LmjF28,GFF,http://PlasmoDB.org/common/downloads/Current_Release/PbergheiANKA/gff/data/PlasmoDB-28_PbergheiANKA.gff,28,Plasmodium berghei ANKA,5823,TRUE,PlasmoDB,Keith Hughitt <khughitt@umd.edu>,TxDb,Rda,LmjF_TxDb.rda
Genome annotations for Plasmodium chabaudi chabaudi,PlasmoDB 28 annotations for Plasmodium chabaudi chabaudi,3.4,LmjF28,GFF,http://PlasmoDB.org/common/downloads/Current_Release/Pchabaudichabaudi/gff/data/PlasmoDB-28_Pchabaudichabaudi.gff,28,Plasmodium chabaudi chabaudi,31271,TRUE,PlasmoDB,Keith Hughitt <khughitt@umd.edu>,TxDb,Rda,LmjF_TxDb.rda
Genome annotations for Plasmodium coatneyi Hackeri,PlasmoDB 28 annotations for Plasmodium coatneyi Hackeri,3.4,LmjF28,GFF,http://PlasmoDB.org/common/downloads/Current_Release/PcoatneyiHackeri/gff/data/PlasmoDB-28_PcoatneyiHackeri.gff,28,Plasmodium coatneyi Hackeri,NA,TRUE,PlasmoDB,Keith Hughitt <khughitt@umd.edu>,TxDb,Rda,LmjF_TxDb.rda
Genome annotations for Plasmodium cynomolgi strain B,PlasmoDB 28 annotations for Plasmodium cynomolgi strain B,3.4,LmjF28,GFF,http://PlasmoDB.org/common/downloads/Current_Release/PcynomolgiB/gff/data/PlasmoDB-28_PcynomolgiB.gff,28,Plasmodium cynomolgi strain B,1120755,TRUE,PlasmoDB,Keith Hughitt <khughitt@umd.edu>,TxDb,Rda,LmjF_TxDb.rda
Genome annotations for Plasmodium falciparum 3D7,PlasmoDB 28 annotations for Plasmodium falciparum 3D7,3.4,LmjF28,GFF,http://PlasmoDB.org/common/downloads/Current_Release/Pfalciparum3D7/gff/data/PlasmoDB-28_Pfalciparum3D7.gff,28,Plasmodium falciparum 3D7,36329,TRUE,PlasmoDB,Keith Hughitt <khughitt@umd.edu>,TxDb,Rda,LmjF_TxDb.rda
Genome annotations for Plasmodium falciparum IT,PlasmoDB 28 annotations for Plasmodium falciparum IT,3.4,LmjF28,GFF,http://PlasmoDB.org/common/downloads/Current_Release/PfalciparumIT/gff/data/PlasmoDB-28_PfalciparumIT.gff,28,Plasmodium falciparum IT,NA,TRUE,PlasmoDB,Keith Hughitt <khughitt@umd.edu>,TxDb,Rda,LmjF_TxDb.rda
Genome annotations for Plasmodium gallinaceum 8A,PlasmoDB 28 annotations for Plasmodium gallinaceum 8A,3.4,LmjF28,GFF,http://PlasmoDB.org/common/downloads/Current_Release/Pgallinaceum8A/gff/data/PlasmoDB-28_Pgallinaceum8A.gff,28,Plasmodium gallinaceum 8A,NA,TRUE,PlasmoDB,Keith Hughitt <khughitt@umd.edu>,TxDb,Rda,LmjF_TxDb.rda
Genome annotations for Plasmodium knowlesi strain H,PlasmoDB 28 annotations for Plasmodium knowlesi strain H,3.4,LmjF28,GFF,http://PlasmoDB.org/common/downloads/Current_Release/PknowlesiH/gff/data/PlasmoDB-28_PknowlesiH.gff,28,Plasmodium knowlesi strain H,5851,TRUE,PlasmoDB,Keith Hughitt <khughitt@umd.edu>,TxDb,Rda,LmjF_TxDb.rda
Genome annotations for Plasmodium reichenowi CDC,PlasmoDB 28 annotations for Plasmodium reichenowi CDC,3.4,LmjF28,GFF,http://PlasmoDB.org/common/downloads/Current_Release/PreichenowiCDC/gff/data/PlasmoDB-28_PreichenowiCDC.gff,28,Plasmodium reichenowi CDC,NA,TRUE,PlasmoDB,Keith Hughitt <khughitt@umd.edu>,TxDb,Rda,LmjF_TxDb.rda
Genome annotations for Plasmodium vivax Sal-1,PlasmoDB 28 annotations for Plasmodium vivax Sal-1,3.4,LmjF28,GFF,http://PlasmoDB.org/common/downloads/Current_Release/PvivaxSal1/gff/data/PlasmoDB-28_PvivaxSal1.gff,28,Plasmodium vivax Sal-1,126793,TRUE,PlasmoDB,Keith Hughitt <khughitt@umd.edu>,TxDb,Rda,LmjF_TxDb.rda
Genome annotations for Plasmodium yoelii yoelii 17X,PlasmoDB 28 annotations for Plasmodium yoelii yoelii 17X,3.4,LmjF28,GFF,http://PlasmoDB.org/common/downloads/Current_Release/Pyoeliiyoelii17X/gff/data/PlasmoDB-28_Pyoeliiyoelii17X.gff,28,Plasmodium yoelii yoelii 17X,NA,TRUE,PlasmoDB,Keith Hughitt <khughitt@umd.edu>,TxDb,Rda,LmjF_TxDb.rda
Genome annotations for Plasmodium yoelii yoelii 17XNL,PlasmoDB 28 annotations for Plasmodium yoelii yoelii 17XNL,3.4,LmjF28,GFF,http://PlasmoDB.org/common/downloads/Current_Release/Pyoeliiyoelii17XNL/gff/data/PlasmoDB-28_Pyoeliiyoelii17XNL.gff,28,Plasmodium yoelii yoelii 17XNL,352914,TRUE,PlasmoDB,Keith Hughitt <khughitt@umd.edu>,TxDb,Rda,LmjF_TxDb.rda
Genome annotations for Plasmodium yoelii yoelii YM,PlasmoDB 28 annotations for Plasmodium yoelii yoelii YM,3.4,LmjF28,GFF,http://PlasmoDB.org/common/downloads/Current_Release/PyoeliiyoeliiYM/gff/data/PlasmoDB-28_PyoeliiyoeliiYM.gff,28,Plasmodium yoelii yoelii YM,NA,TRUE,PlasmoDB,Keith Hughitt <khughitt@umd.edu>,TxDb,Rda,LmjF_TxDb.rda
Genome annotations for Spraguea lophii 42_110,MicrosporidiaDB 28 annotations for Spraguea lophii 42_110,3.4,LmjF28,GFF,http://MicrosporidiaDB.org/common/downloads/Current_Release/Slophii42_110/gff/data/MicrosporidiaDB-28_Slophii42_110.gff,28,Spraguea lophii 42_110,1358809,TRUE,MicrosporidiaDB,Keith Hughitt <khughitt@umd.edu>,TxDb,Rda,LmjF_TxDb.rda
Genome annotations for Sarcocystis neurona SN1,ToxoDB 28 annotations for Sarcocystis neurona SN1,3.4,LmjF28,GFF,http://ToxoDB.org/common/downloads/Current_Release/SneuronaSN1/gff/data/ToxoDB-28_SneuronaSN1.gff,28,Sarcocystis neurona SN1,NA,TRUE,ToxoDB,Keith Hughitt <khughitt@umd.edu>,TxDb,Rda,LmjF_TxDb.rda
Genome annotations for Sarcocystis neurona SN3,ToxoDB 28 annotations for Sarcocystis neurona SN3,3.4,LmjF28,GFF,http://ToxoDB.org/common/downloads/Current_Release/SneuronaSN3/gff/data/ToxoDB-28_SneuronaSN3.gff,28,Sarcocystis neurona SN3,NA,TRUE,ToxoDB,Keith Hughitt <khughitt@umd.edu>,TxDb,Rda,LmjF_TxDb.rda
Genome annotations for Spironucleus salmonicida ATCC50377,GiardiaDB 28 annotations for Spironucleus salmonicida ATCC50377,3.4,LmjF28,GFF,http://GiardiaDB.org/common/downloads/Current_Release/SsalmonicidaATCC50377/gff/data/GiardiaDB-28_SsalmonicidaATCC50377.gff,28,Spironucleus salmonicida ATCC50377,NA,TRUE,GiardiaDB,Keith Hughitt <khughitt@umd.edu>,TxDb,Rda,LmjF_TxDb.rda
Genome annotations for Theileria annulata strain Ankara,PiroplasmaDB 28 annotations for Theileria annulata strain Ankara,3.4,LmjF28,GFF,http://PiroplasmaDB.org/common/downloads/Current_Release/TannulataAnkara/gff/data/PiroplasmaDB-28_TannulataAnkara.gff,28,Theileria annulata strain Ankara,353154,TRUE,PiroplasmaDB,Keith Hughitt <khughitt@umd.edu>,TxDb,Rda,LmjF_TxDb.rda
Genome annotations for Trypanosoma brucei Lister strain 427,TriTrypDB 28 annotations for Trypanosoma brucei Lister strain 427,3.4,LmjF28,GFF,http://TriTrypDB.org/common/downloads/Current_Release/TbruceiLister427/gff/data/TriTrypDB-28_TbruceiLister427.gff,28,Trypanosoma brucei Lister strain 427,NA,TRUE,TriTrypDB,Keith Hughitt <khughitt@umd.edu>,TxDb,Rda,LmjF_TxDb.rda
Genome annotations for Trypanosoma brucei TREU927,TriTrypDB 28 annotations for Trypanosoma brucei TREU927,3.4,LmjF28,GFF,http://TriTrypDB.org/common/downloads/Current_Release/TbruceiTREU927/gff/data/TriTrypDB-28_TbruceiTREU927.gff,28,Trypanosoma brucei TREU927,185431,TRUE,TriTrypDB,Keith Hughitt <khughitt@umd.edu>,TxDb,Rda,LmjF_TxDb.rda
Genome annotations for Trypanosoma brucei gambiense DAL972,TriTrypDB 28 annotations for Trypanosoma brucei gambiense DAL972,3.4,LmjF28,GFF,http://TriTrypDB.org/common/downloads/Current_Release/TbruceigambienseDAL972/gff/data/TriTrypDB-28_TbruceigambienseDAL972.gff,28,Trypanosoma brucei gambiense DAL972,679716,TRUE,TriTrypDB,Keith Hughitt <khughitt@umd.edu>,TxDb,Rda,LmjF_TxDb.rda
Genome annotations for Trypanosoma congolense IL3000,TriTrypDB 28 annotations for Trypanosoma congolense IL3000,3.4,LmjF28,GFF,http://TriTrypDB.org/common/downloads/Current_Release/TcongolenseIL3000/gff/data/TriTrypDB-28_TcongolenseIL3000.gff,28,Trypanosoma congolense IL3000,1068625,TRUE,TriTrypDB,Keith Hughitt <khughitt@umd.edu>,TxDb,Rda,LmjF_TxDb.rda
Genome annotations for Trypanosoma cruzi strain CL Brener,TriTrypDB 28 annotations for Trypanosoma cruzi strain CL Brener,3.4,LmjF28,GFF,http://TriTrypDB.org/common/downloads/Current_Release/TcruziCLBrener/gff/data/TriTrypDB-28_TcruziCLBrener.gff,28,Trypanosoma cruzi strain CL Brener,353153,TRUE,TriTrypDB,Keith Hughitt <khughitt@umd.edu>,TxDb,Rda,LmjF_TxDb.rda
Genome annotations for Trypanosoma cruzi CL Brener Esmeraldo-like,TriTrypDB 28 annotations for Trypanosoma cruzi CL Brener Esmeraldo-like,3.4,LmjF28,GFF,http://TriTrypDB.org/common/downloads/Current_Release/TcruziCLBrenerEsmeraldo-like/gff/data/TriTrypDB-28_TcruziCLBrenerEsmeraldo-like.gff,28,Trypanosoma cruzi CL Brener Esmeraldo-like,NA,TRUE,TriTrypDB,Keith Hughitt <khughitt@umd.edu>,TxDb,Rda,LmjF_TxDb.rda
Genome annotations for Trypanosoma cruzi CL Brener Non-Esmeraldo-like,TriTrypDB 28 annotations for Trypanosoma cruzi CL Brener Non-Esmeraldo-like,3.4,LmjF28,GFF,http://TriTrypDB.org/common/downloads/Current_Release/TcruziCLBrenerNon-Esmeraldo-like/gff/data/TriTrypDB-28_TcruziCLBrenerNon-Esmeraldo-like.gff,28,Trypanosoma cruzi CL Brener Non-Esmeraldo-like,NA,TRUE,TriTrypDB,Keith Hughitt <khughitt@umd.edu>,TxDb,Rda,LmjF_TxDb.rda
Genome annotations for Trypanosoma cruzi Dm28c,TriTrypDB 28 annotations for Trypanosoma cruzi Dm28c,3.4,LmjF28,GFF,http://TriTrypDB.org/common/downloads/Current_Release/TcruziDm28c/gff/data/TriTrypDB-28_TcruziDm28c.gff,28,Trypanosoma cruzi Dm28c,1416333,TRUE,TriTrypDB,Keith Hughitt <khughitt@umd.edu>,TxDb,Rda,LmjF_TxDb.rda
